{
  "id": "TC-006",
  "status": "pending_review",
  "type": "dirección opuesta",
  "mechanical_relation": "Se separan en polos: herramientas de IA co-ocurren con señales de mayor oferta de productos digitales de bajo esfuerzo; al mismo tiempo, señales de demanda de calidad y diferenciación se concentran en el mismo mercado. Fuerza A: IA y automatización aumentan el volumen de oferta de bajo esfuerzo. Fuerza B: señales de compradores documentan preferencia por calidad y diferenciación conforme aumenta la oferta de bajo esfuerzo.",
  "analytical_unit": "señales de oferta de productos digitales y señales de demanda de compradores en el mismo mercado, separadas de factores de distribución de plataformas",
  "signal_ids": [
    "SC-R3-132",
    "SC-R6-145",
    "SC-R6-147",
    "SC-R2-092",
    "SC-R2-090",
    "SC-R2-106",
    "SC-R2-094",
    "SC-R2-095"
  ],
  "structured_support": {
    "poles": [
      {
        "label": "Polo A — aumento de oferta de bajo esfuerzo facilitado por IA",
        "definition": "Cards que documentan aumento de oferta de productos digitales de bajo esfuerzo facilitado por IA en el corpus",
        "signal_ids": [
          {"id": "SC-R3-132", "description": "Growing Your Craft 2026: mercado con flood de contenido AI-generado de bajo esfuerzo; compradores más inteligentes"},
          {"id": "SC-R6-145", "description": "@emilyestheruk abril 2026: competencia increíble en Canva templates; mercado completamente inundado"},
          {"id": "SC-R6-147", "description": "EcommerceFastlane sept. 2025: cada página de Etsy y Gumroad se ve igual: planners y bundles en gradientes pastel"},
          {"id": "SC-R2-092", "description": "Emily McDermott con $280K en revenue de Etsy se describe como 'not a spreadsheet expert by any means'"}
        ],
        "mechanical_summary": "Cuatro cards documentan saturación de oferta y homogeneización de productos digitales en Etsy y Gumroad. Las fuentes son blog de análisis, foro y testimonio de seller. No están normalizadas por categoría de producto, plataforma ni período.",
        "unit_used": "observaciones cualitativas sobre volumen y homogeneización de oferta de productos digitales"
      },
      {
        "label": "Polo B — demanda de calidad y diferenciación de compradores",
        "definition": "Cards que documentan señales de demanda de calidad y diferenciación de compradores en el mismo mercado",
        "signal_ids": [
          {"id": "SC-R2-090", "description": "SendOwl blog marzo 2026: features que hacen vender templates — fórmulas bloqueadas, validación de datos, instrucciones claras"},
          {"id": "SC-R2-094", "description": "LinkedIn / Michael Belfry: perfil comprador Excel: habilidades limitadas, quieren spreadsheets construidas por otros"},
          {"id": "SC-R2-095", "description": "LinkedIn / Michael Belfry: compradores quieren 'purpose-built spreadsheet optimized for data entry with summary dashboard'"},
          {"id": "SC-R2-106", "description": "Marketsy.io: vendedores exitosos crean soluciones para problemas específicos, no diseño genérico"}
        ],
        "mechanical_summary": "Cuatro cards de fuentes analíticas y guías de vendedores documentan que compradores buscan funcionalidad específica, no diseño genérico. Estas señales son de compradores de templates de hojas de cálculo principalmente, no de planners digitales o prompts.",
        "unit_used": "observaciones sobre características que determinan la decisión de compra de templates de hojas de cálculo"
      }
    ]
  },
  "what_it_supports": {
    "yes": "Coexistencia de señales de saturación de oferta de bajo esfuerzo con señales de demanda de calidad y especificidad en el mismo mercado de productos digitales durante el período 2025–2026.",
    "no": "Que la fuerza B neutraliza la fuerza A o que los compradores abandonan plataformas por la saturación. Que las señales de calidad del Polo B corresponden exactamente a los mismos compradores afectados por la saturación del Polo A."
  },
  "what_is_missing": [
    "Datos de ventas que distingan productos de bajo esfuerzo de productos de alta calidad en las mismas categorías.",
    "Señales de compradores sobre sus decisiones ante la saturación.",
    "Separación por categoría: el Polo A cubre Canva templates y planners; el Polo B cubre principalmente spreadsheets.",
    "Evidencia temporal de si la demanda de calidad ha aumentado en respuesta al aumento de oferta de bajo esfuerzo."
  ],
  "classification_risk": [
    "posible agrupación disfrazada de tensión",
    "posible sobre-abstracción",
    "posible artefacto de fuente"
  ],
  "source_patterns": ["OPP-001"],
  "human_fields": {
    "human_context": "",
    "provisional_tension_name": "",
    "dt_question_enabled": "",
    "human_review_decision": "",
    "decision_rationale": ""
  }
}
