{
  "id": "TC-094",
  "status": "needs_audit_before_classification",
  "type": "co-ocurrencia significativa",
  "mechanical_relation": "co-ocurre figura '11,000 users' asociada a PromptBase en 2 cards de 1 rounds distintos.",
  "analytical_unit": "possible dedup: figura '11,000 users' en contexto PromptBase en rounds [7]. Verificar si provienen de la misma fuente original.",
  "signal_ids": [
    "SC-R7-022",
    "SC-R7-025"
  ],
  "structured_support": {
    "poles": [
      {
        "label": "Polo A",
        "definition": "señales agrupadas bajo este patrón (lado A) dentro del corpus",
        "signal_ids": [
          {
            "id": "SC-R7-022",
            "description": "PromptBase had 11,000 users in early months (late 2022)."
          }
        ],
        "mechanical_summary": "co-ocurre figura '11,000 users' asociada a PromptBase en 2 cards de 1 rounds distintos.",
        "unit_used": "mixed"
      },
      {
        "label": "Polo B",
        "definition": "señales agrupadas bajo este patrón (lado B) dentro del corpus",
        "signal_ids": [
          {
            "id": "SC-R7-025",
            "description": "PromptBase had 11,000 users in early months (late 2022)."
          }
        ],
        "mechanical_summary": "contraparte del patrón detectado",
        "unit_used": "mixed"
      }
    ]
  },
  "what_it_supports": {
    "yes": "Coexistencia de los patrones documentados en las cards referenciadas.",
    "no": "Una explicación causal de por qué ocurre este patrón. Que el patrón se extienda más allá de lo observado en el corpus."
  },
  "what_is_missing": [
    "Normalización por unidad temporal y monetaria entre las cards.",
    "Separación por plataforma, tipo de producto y geografía.",
    "Verificación de si este patrón persiste con datos más recientes."
  ],
  "classification_risk": [
    "posible agrupación disfrazada de tensión",
    "posible artefacto del detector"
  ],
  "source_patterns": [
    "LEX-060"
  ],
  "human_fields": {
    "human_context": "",
    "provisional_tension_name": "",
    "dt_question_enabled": "",
    "human_review_decision": "",
    "decision_rationale": ""
  }
}