{
  "id": "TC-031",
  "status": "pending_review",
  "type": "fricción",
  "mechanical_relation": "co-ocurre: la falta de hipervinculos funcionales en GoodNotes para Windows y Android bloquea la navegacion en planners digitales documentados como dependientes de hipervinculos.",
  "analytical_unit": "Bloqueador documentado: limitacion tecnica de GoodNotes Windows/Android sin hipervinculos. Bloqueado documentado: planners digitales cuya funcionalidad depende de hipervinculos. Mecanismo claro con soporte de 4 tarjetas.",
  "signal_ids": [
    "SC-R9-118",
    "SC-R9-119",
    "SC-R9-120",
    "SC-R9-125"
  ],
  "structured_support": {
    "poles": [
      {
        "label": "Blocker",
        "definition": "GoodNotes para Windows y Android no implementa hipervinculos interactivos",
        "signal_ids": [
          {
            "id": "SC-R9-118",
            "description": "Future ADHD (digital planner seller, 2026 copyright) lists devices and apps explicitly NOT compatibl"
          },
          {
            "id": "SC-R9-119",
            "description": "Future ADHD reports that GoodNotes on Android is \"currently in BETA\" with limited functionality, and"
          }
        ],
        "mechanical_summary": "GoodNotes para Windows y Android no implementa hipervinculos interactivos",
        "unit_used": "mixed (ver classification_risk)"
      },
      {
        "label": "Blocked",
        "definition": "Navegacion interna en planners digitales basados en hipervinculos no funciona",
        "signal_ids": [
          {
            "id": "SC-R9-120",
            "description": "Future ADHD states that device/app compatibility is \"our most asked question.\""
          },
          {
            "id": "SC-R9-125",
            "description": "InMotion Planner states that GoodNotes versions for Windows and Android are \"not recommended for dig"
          }
        ],
        "mechanical_summary": "Navegacion interna en planners digitales basados en hipervinculos no funciona",
        "unit_used": "mixed (ver classification_risk)"
      }
    ]
  },
  "what_it_supports": {
    "yes": "Coexistencia de los patrones documentados en las cards referenciadas.",
    "no": "Una explicación causal de por qué ocurre este patrón. Que el patrón se extienda más allá de lo observado en el corpus."
  },
  "what_is_missing": [
    "Normalización por unidad temporal y monetaria entre las cards.",
    "Separación por plataforma, tipo de producto y geografía.",
    "Verificación de si este patrón persiste con datos más recientes."
  ],
  "classification_risk": [
    "posible artefacto de fuente",
    "posible sobre-abstracción"
  ],
  "source_patterns": [
    "FRI-010"
  ],
  "human_fields": {
    "human_context": "",
    "provisional_tension_name": "",
    "dt_question_enabled": "",
    "human_review_decision": "",
    "decision_rationale": ""
  }
}