{
  "id": "TC-111",
  "status": "pending_review",
  "type": "dirección opuesta",
  "mechanical_relation": "Se separa en polos: señales de ingresos elevados de vendedores outliers co-ocurren con señales de ingresos típicos o medianos bajos o nulos en el mismo mercado de productos digitales.",
  "analytical_unit": "Both forces documented with minimum 2 cards each, acting on the same seller income system.",
  "signal_ids": [
    "SC-R10-042",
    "SC-R2-070",
    "SC-R3-033",
    "SC-R4-013",
    "SC-R4-035",
    "SC-R4-036",
    "SC-R4-068",
    "SC-R4-150",
    "SC-R6-093",
    "SC-R7-106",
    "SC-R7-121",
    "SC-R8-127",
    "SC-R8-128",
    "SC-R8-171"
  ],
  "structured_support": {
    "poles": [
      {
        "label": "Force A: Outlier/high-income seller cases",
        "definition": "Cards document exceptional seller revenue figures, high-income outlier cases on digital product platforms.",
        "signal_ids": [
          {
            "id": "SC-R2-070",
            "description": "Emily McDermott (PrettyArrow) claims $280,000 in revenue selling spreadsheet templates, primarily on"
          },
          {
            "id": "SC-R3-033",
            "description": "Red Cheeks Girl reports that AmethystGarnet's top products bring in $50,000+ monthly."
          },
          {
            "id": "SC-R6-093",
            "description": "Katya Varbanova claims $1.4 million in revenue selling Canva templates in under 3 years, working les"
          },
          {
            "id": "SC-R4-068",
            "description": "An Australian Etsy seller (Planprintland) made $82,053 AUD (~$56,670 USD) in 2022 spending only 10-1"
          },
          {
            "id": "SC-R8-171",
            "description": "Thomas Frank, prominent Notion template creator earning $110,000+/month, switched from Gumroad to Le"
          },
          {
            "id": "SC-R10-042",
            "description": "\"Refactoring UI\" generated $2.3M+ in sales."
          }
        ],
        "mechanical_summary": "Cards document exceptional seller revenue figures, high-income outlier cases on digital product platforms.",
        "unit_used": "mixed (ver classification_risk)"
      },
      {
        "label": "Force B: Typical/median seller income low or zero",
        "definition": "Cards document low or zero typical earnings for the majority of sellers, survey data, and exit rates due to insufficient income.",
        "signal_ids": [
          {
            "id": "SC-R4-035",
            "description": "Marmalead's 2023 analysis shows median revenue at $1,200/year across all Etsy sellers."
          },
          {
            "id": "SC-R4-036",
            "description": "The aggregation states only 20% of Etsy shops sustain full-time income."
          },
          {
            "id": "SC-R4-013",
            "description": "Reddit user ricks_flare made only $300 in an entire year (~$25/month) from Etsy printables, despite "
          },
          {
            "id": "SC-R4-150",
            "description": "A creator made over 10 digital products, none of which sold. States: \"I created over 10 digital prod"
          },
          {
            "id": "SC-R7-106",
            "description": "implo.ai states \"60–70% of people who list prompts make under $50/month.\""
          },
          {
            "id": "SC-R7-121",
            "description": "The same seller claims income on PromptBase is \"negligible\" for most sellers and there are \"signific"
          },
          {
            "id": "SC-R8-127",
            "description": "Analysis of 146,271 Gumroad products found the median product earns 28 sales at a $13 median price ("
          },
          {
            "id": "SC-R8-128",
            "description": "Only 0.5% of Gumroad products cross 1,000 sales; the bottom 34% have 1-10 sales total."
          }
        ],
        "mechanical_summary": "Cards document low or zero typical earnings for the majority of sellers, survey data, and exit rates due to insufficient income.",
        "unit_used": "mixed (ver classification_risk)"
      }
    ]
  },
  "what_it_supports": {
    "yes": "Coexistencia de los patrones documentados en las cards referenciadas.",
    "no": "Una explicación causal de por qué ocurre este patrón. Que el patrón se extienda más allá de lo observado en el corpus."
  },
  "what_is_missing": [
    "Normalización por unidad temporal y monetaria entre las cards.",
    "Separación por plataforma, tipo de producto y geografía.",
    "Verificación de si este patrón persiste con datos más recientes."
  ],
  "classification_risk": [
    "posible sobre-abstracción",
    "posible artefacto de fuente"
  ],
  "source_patterns": [
    "OPP-008"
  ],
  "human_fields": {
    "human_context": "",
    "provisional_tension_name": "",
    "dt_question_enabled": "",
    "human_review_decision": "",
    "decision_rationale": ""
  }
}